,Time,Link,Title,Authors,Tickers,Strategy
0," May 24, 2017, 7:09 AM ",/article/4076004-xinyuan-1q17-results-signals-strong-year,Xinyuan 1Q17 Results And Signals Of A Strong Year, John Sheehy,XIN,Long
1, MCD,/article/4075963-mcdonalds-learning-mistakes,McDonald's: Learning From Mistakes," May 24, 2017, 3:12 AM ",Editors' Pick ,Long
2," May 24, 2017, 2:43 AM ",/article/4075958-wirecard-ag-makes-attractive-exposure-growth-payments-processing-space,Here's Why Wirecard AG Makes For An Attractive Exposure To Growth In The Payments Processing Space, Samuel Rae,WRCDF,Long
3," May 24, 2017, 12:51 AM ",/article/4075941-apple-nokia-settle-differences,Apple And Nokia Settle Their Differences, Mark Hibben,AAPL,Long
4," May 23, 2017, 8:48 PM ",/article/4075925-nike-still-best-bet-industry-attractive-entry-point,"Nike: Still The Best Bet In The Industry, At An Attractive Entry Point", Kenra Investors,NKE,Long
5," May 23, 2017, 8:23 PM ",/article/4075924-keep-buying-dr-pepper-snapple-group,Keep Buying Dr Pepper Snapple Group, Societe Financiers,DPS,Long
6," May 23, 2017, 7:29 PM ",/article/4075918-valero-provides-good-return-shareholders,Valero Provides A Good Return To Shareholders, Searching For Value,VLO,Long
7," May 23, 2017, 6:20 PM ",/article/4075905-eaton-marking-time-preparing-revolution,Eaton: Marking Time Or Preparing A Revolution?, John Abbink,ETN,Long
8," May 23, 2017, 5:53 PM ",/article/4075872-wal-mart-offer-best-value,Does Wal-Mart Offer The Best Value?, Jonathan Weber,WMT,Long
9," May 23, 2017, 5:16 PM ",/article/4075870-happened-genzyme-cvr-since-august-2015,What Happened With The Genzyme CVR Since August 2015, Ruerd Heeg,GCVRZ,Long
10," May 23, 2017, 5:05 PM ",/article/4075867-bank-america-declines-will-temporary,Bank Of America: These Declines Will Be Temporary, Dividend Investors,BAC,Long
11," May 23, 2017, 4:54 PM ",/article/4075856-mid-con-energy-partners-opec-supply-cut-extension-alleviate-borrowing-base-uncertainty,Mid-Con Energy Partners: OPEC Supply Cut Extension Should Alleviate Borrowing Base Uncertainty, Elephant Analytics,MCEP,Long
12," May 23, 2017, 4:28 PM ",/article/4075844-stormy-weather-shortsville-ahead-fleetcor-technologies-shortsellers,'Stormy Weather In Shortsville' Ahead For FleetCor Technologies Shortsellers, Theodore Walker,FLT,Long
13," May 23, 2017, 4:16 PM ",/article/4075854-philip-morris-quest-smokeless-future,Philip Morris: The Quest For A Smokeless Future, Timberwolf Equity Research,PM,Long
14," May 23, 2017, 4:14 PM ",/article/4075853-invitae-diagnosed-oversold,When Is Invitae Diagnosed As Oversold?, Strong Bio,NVTA,Long
15, FUNC,/article/4075426-first-united-corporation-repositioning-capital-structure-regional-worth-look,"First United Corporation: After Repositioning Its Capital Structure, This Regional Is Worth A Look"," May 23, 2017, 4:11 PM ",Editors' Pick ,Long
16," May 23, 2017, 3:56 PM ",/article/4075840-tractor-supply-co-excited-petsense,Why Tractor Supply Co. Is Excited About Petsense, Samuel Smith,TSCO,Long
17," May 23, 2017, 3:53 PM ",/article/4075816-amc-looks-good,AMC Looks Good Here, Timothy Gornall,AMC,Long
18," May 23, 2017, 3:07 PM ",/article/4075809-facebooks-foray-ad-targeting-produce-solid-new-revenue-stream,Facebook's Foray Into Ad Targeting Could Produce Solid New Revenue Stream, Gary Bourgeault,FB,Long
19," May 23, 2017, 3:01 PM ",/article/4075803-vivint-solar-just-beginning,Vivint Solar: It's Just The Beginning, Celeritas Investments,VSLR,Long
20," May 23, 2017, 2:54 PM ",/article/4075782-shopify-supply-shares-fall,Shopify: Supply Of Shares About To Fall, Save Money Retire Early,SHOP,Long
21," May 23, 2017, 2:41 PM ",/article/4075791-valeant-valuation-check,Valeant: A Valuation Check, HealthBlogger,VRX,Long
22," May 23, 2017, 2:11 PM ",/article/4075775-despite-impressive-run-6-percent-yielder-still-offers-value,"Despite An Impressive Run, This 6% Yielder Still Offers Value", Renaissance Research,SPXXF,Long
23," May 23, 2017, 2:10 PM ",/article/4075774-general-electric-really-driving-decline,General Electric: What's Really Driving The Decline, Andrew McElroy,GE,Long
24," May 23, 2017, 2:09 PM ",/article/4075772-baytex-energy-head-slaughter-house,Baytex Energy: Head To The Slaughter House, Long Player,BTE,Long
25," May 23, 2017, 1:59 PM ",/article/4075759-stalking-facebook,Stalking Facebook, Markos Kaminis,FB,Long
26," May 23, 2017, 1:54 PM ",/article/4075736-tencent-investment-recommendation,Tencent Investment Recommendation, Meng W,TCEHY,Long
27," May 23, 2017, 1:49 PM ",/article/4075754-j-and-j-core-holding-pharmaceutical-space,J&J Is A Core Holding In The Pharmaceutical Space, HealthBlogger,JNJ,Long
28," May 23, 2017, 1:33 PM ",/article/4075740-amd-vega-nvidia-killer,AMD: Vega Is A Nvidia Killer, Motoko Buffett,AMD,Long
29," May 23, 2017, 1:25 PM ",/article/4075709-iconix-expansion-brands-slated-bring-major-second-half-growth,Iconix: Expansion Of Brands Is Slated To Bring Major Second-Half Growth, Upside Research,ICON,Long
30," May 23, 2017, 1:24 PM ",/article/4075707-lockheed-martin-going-anywhere-long-know-customers,Lockheed Martin Isn't Going Anywhere - So Long As They Know Their Customers, Helena Leathers,LMT,Long
31," May 23, 2017, 1:20 PM ",/article/4075705-mgm-resorts-catalysts-already-place-tell-powerful-story,MGM Resorts - Catalysts Already In Place Tell A Powerful Story, Howard Jay Klein,MGM,Long
32," May 23, 2017, 1:07 PM ",/article/4075725-netease-chinese-tech-conglomerate-least-20-percent-undervalued,NetEase: This Chinese Tech Conglomerate Is At Least 20% Undervalued, Logical Tech Investor,NTES,Long
33," May 23, 2017, 1:02 PM ",/article/4075714-price-retailer-antithesis-amazon,This Off-Price Retailer Is The Antithesis Of Amazon, David J. Waldron,TJX,Long
34," May 23, 2017, 12:54 PM ",/article/4075708-zynga-partners-netease-china-expansion,Zynga Partners With NetEase For Its China Expansion, Motek Moyen,ZNGA,Long
35," May 23, 2017, 12:49 PM ",/article/4075704-qualcomm-still-upward-potential,Qualcomm Still Has Upward Potential, Searching For Value,QCOM,Long
36," May 23, 2017, 11:57 AM ",/article/4075689-gilead-great-opportunity-gilead-contrarian-investors,Gilead: A Great Opportunity In Gilead For Contrarian Investors, Michael Wiggins De Oliveira,GILD,Long
37," May 23, 2017, 11:43 AM ",/article/4075671-jim-hackett-management-guru-ford-shareholders-rejoice,Jim Hackett Is A Management Guru And Ford Shareholders Should Rejoice, Cloister Research,F,Long
38," May 23, 2017, 11:30 AM ",/article/4075666-viking-therapeutics-good-bad-maybe-ugly,"Viking Therapeutics: The Good, The Bad, And (Maybe) The Ugly", Life Sciences Millennial,VKTX,Long
39," May 23, 2017, 10:38 AM ",/article/4075648-apple-itunes-app-store-double-sales-google-play-store,Why Apple iTunes App Store Has Double The Sales Of Google Play Store, Motek Moyen,AAPL,Long
40," May 23, 2017, 9:44 AM ",/article/4075608-galectin-therapeutics-serendipity-psoriasis-strength-nash,"Galectin Therapeutics: Serendipity In Psoriasis, Strength In NASH", BioSci Capital Partners,GALT,Long
41," May 23, 2017, 9:41 AM ",/article/4075604-celgene-crippled-pipeline-ms-drug-buy-dip,"Celgene - Crippled By Its Pipeline MS Drug? Or, Buy The Dip?", DoctoRx,CELG,Long
42," May 23, 2017, 9:35 AM ",/article/4075597-novo-nordisk-worst,Novo Nordisk: The Worst Is Over, Daniel Schönberger,NVO,Long
43," May 23, 2017, 9:23 AM ",/article/4075592-akebia-therapeutics-breaking,Akebia Therapeutics Breaking Out?, Strong Bio,AKBA,Long
44," May 23, 2017, 9:10 AM ",/article/4075589-high-profile-investors-just-bought-qualcomm,These High Profile Investors Just Bought Qualcomm And You Should Too, First Floor Finance,QCOM,Long
45," May 23, 2017, 9:06 AM ",/article/4075588-new-york-community-bank-get-lions-den,New York Community Bank: How To Get Out Of The Lion's Den, Stephen Rosenman,NYCB,Long
46," May 23, 2017, 9:04 AM ",/article/4075580-time-throw-towel-armour,Time To Throw In The Towel On Under Armour?, Small-Cap Detective,UAA,Long
47," May 23, 2017, 8:27 AM ",/article/4075577-barrons-agree-tjx-companies-ross-stores-will-thrive-amazon-world,Barron's And I Both Agree: TJX Companies And Ross Stores Will Thrive In An Amazon World, Minutemen,"TJX, ROST",Long
48, SQNS,/article/4075571-sequans-opportunity-ahead,Sequans: The Opportunity Ahead," May 23, 2017, 7:56 AM ",Editors' Pick ,Long
49," May 23, 2017, 7:49 AM ",/article/4075569-alliance-one-international-mispriced-opportunity,Alliance One International: Mispriced Opportunity, Reid Hudson,AOI,Long
50," May 23, 2017, 7:47 AM ",/article/4075568-pretium-nearing-first-gold-pour-giant-brucejack-project,Pretium Is Nearing First Gold Pour At The Giant Brucejack Project, Fabio Herrero,PVG,Long
51," CTTPY, HDUGF, EUSC",/article/4075512-marketplace-roundtable-europe-rising,Marketplace Roundtable: Europe Rising," May 23, 2017, 7:30 AM ",Editors' Pick ,Long
52," May 23, 2017, 6:34 AM ",/article/4075551-first-mining-finance-offers-cheap-exposure-higher-gold-prices,First Mining Finance Offers Cheap Exposure To Higher Gold Prices, Fabio Herrero,FFMGF,Long
53," May 23, 2017, 6:09 AM ",/article/4075549-tg-therapeutics-promising-ms-data,TG Therapeutics: Promising MS Data, ONeil Trader,TGTX,Long
54," May 23, 2017, 5:56 AM ",/article/4075547-group-1-automotive-growth-way,Group 1 Automotive: More Growth On The Way?, Samuel Smith,GPI,Long
55," May 23, 2017, 5:10 AM ",/article/4075535-positive-clinical-results-ahead-acadia-pharmaceuticals,Positive Clinical Results Ahead For Acadia Pharmaceuticals, Chris Lau,ACAD,Long
56," May 23, 2017, 4:56 AM ",/article/4075522-buy-chinese-shopify-rose-200-percent-year,Buy The Chinese Shopify That Rose 200% This Year?, WappCap,BZUN,Long
57," May 23, 2017, 3:38 AM ",/article/4075508-zero-moat-dying-industry-anemic-business-model-create-favorable-stock-price-new-york-and,"Zero Moat, Dying Industry And Anemic Business Model Create A Favorable Stock Price For New York & Company", ShadowStock,NWY,Long
58," May 23, 2017, 12:45 AM ",/article/4075482-m-homes-solid-buy,M/I Homes Is A Solid Buy, Timothy Gornall,MHO,Long
59," May 23, 2017, 12:14 AM ",/article/4075480-bankrates-changing-revenue-mix-reduces-risk,Bankrate's Changing Revenue Mix Reduces Risk, Simple Qualitative,RATE,Long
60," May 22, 2017, 8:45 PM ",/article/4075471-wall-streets-forecasts-tesla-model-3-deliveries-unreasonably-low,Wall Street's Forecasts For Tesla Model 3 Deliveries Are Unreasonably Low, Trent Eady,TSLA,Long
61," May 22, 2017, 7:36 PM ",/article/4075467-arconic-betting-activism,Arconic: Betting On Activism, Activist Stocks,ARNC,Long
62," May 22, 2017, 5:59 PM ",/article/4075453-galaxy-resources-huge-gains-ahead-lithium-miner,Galaxy Resources: Huge Gains Ahead For This Lithium Miner, Macro Investing,GALXF,Long
63," May 22, 2017, 5:19 PM ",/article/4075445-galectin-therapeutics-1-shot-get-right,Galectin Therapeutics: 1 More Shot To Get It Right?, Matthew Michniewicz,GALT,Long
64, FIZZ,/article/4075438-putting-glaucus-report-rest-part-one-valuation,Putting The Glaucus Report To Rest (Part One: Valuation)," May 22, 2017, 4:47 PM ",Editors' Pick ,Long
65," May 22, 2017, 4:39 PM ",/article/4075434-short-term-momentum-overshadowed-longer-term-need-revenue-streams,Short-Term Momentum Overshadowed By Longer Term Need For More Revenue Streams, Jeremy McKinzie,AAPL,Long
66," May 22, 2017, 4:33 PM ",/article/4075429-check-point-best-play-cyber-security,Check Point: Best Play In Cyber Security?, RoaringInvestor,CHKP,Long
67," May 22, 2017, 4:26 PM ",/article/4075428-salesforce-com-now-counts-ai,Salesforce.com Now Counts On AI, Sramana Mitra,CRM,Long
68," May 22, 2017, 4:19 PM ",/article/4075422-4-reasons-amd-buy-dip,4 Reasons AMD Is A Buy On The Dip, Chris Lau,AMD,Long
69," May 22, 2017, 4:03 PM ",/article/4075424-thing-apples-euro-debt,The Thing About Apple's Euro Debt, Jonathan Weber,AAPL,Long
70, SWKH,/article/4075042-swk-holdings-pharmaceutical-royalty-company-49-percent-upside-book-value,SWK Holdings - A Pharmaceutical Royalty Company With 49% Upside To Book Value," May 22, 2017, 4:00 PM ",Editors' Pick ,Long
71," May 22, 2017, 3:53 PM ",/article/4075412-barrick-gold-still-heading-right-direction-despite-setback,"Barrick Gold Is Still Heading In The Right Direction, Despite The Setback", Sarfaraz A. Khan,ABX,Long
72," May 22, 2017, 3:51 PM ",/article/4075411-ford-shakeup-gm-stays-ahead,Ford Shakeup: GM Stays Ahead, Samuel Smith,GM,Long
73," May 22, 2017, 3:15 PM ",/article/4075402-j-c-penney-buy-sell-hold,"J.C. Penney - Buy, Sell Or Hold?", Seattle Contributor,JCP,Long
74," May 22, 2017, 2:59 PM ",/article/4075404-pandora-funding-boost-kkr-gives-leverage-potential-sell,Pandora: Funding Boost From KKR Gives Leverage In Potential Sell-Out, Raging Bull,P,Long
